{
  "id": "long_read_fastq",
  "childProcessIds": [
    "hutch-pacbio-hifi-16S",
    "process-nf-core-bacass-long-read-2-1-0",
    "process-nf-core-bacass-hybrid-2-1-0"
  ],
  "name": "Long Read Sequencing (FASTQ)",
  "desc": "FASTQ files generated from PacBio or Oxford Nanopore Sequencing",
  "executor": "INGEST",
  "documentationUrl": "https://<DOCS_SITE>/pipelines/catalog-dna-sequencing/",
  "code": {
    "repository": "NA",
    "uri": ""
  },
  "computeDefaults": [],
  "paramMapJson": "",
  "formJson": "",
  "webOptimizationJson": "",
  "fileMappingRules": [
    {
      "description": "PacBio / Oxford Nanopore FASTQ",
      "min": 1,
      "fileNamePatterns": [
        {
          "exampleName": "SampleName.hifi_reads.fastq.gz",
          "description": "FASTQ (.hifi_reads.fastq.gz)",
          "sampleMatchingPattern": "(?P<sampleName>[\\S ]*)\\.hifi_reads\\.(fq|fastq)(\\.gz|)"
        },
        {
          "exampleName": "SampleName_R1.fastq.gz",
          "description": "FASTQ (.fastq.gz)",
          "sampleMatchingPattern": "(?P<sampleName>[\\S ]*)_R1\\.(fq|fastq)(\\.gz|)"
        },
        {
          "exampleName": "SampleName_1.fastq.gz",
          "description": "FASTQ (.fastq.gz)",
          "sampleMatchingPattern": "(?P<sampleName>[\\S ]*)_1\\.(fq|fastq)(\\.gz|)"
        },
        {
          "exampleName": "SampleName.fastq.gz",
          "description": "FASTQ (.fastq.gz)",
          "sampleMatchingPattern": "(?P<sampleName>[\\S ]*)\\.(fq|fastq)(\\.gz|)"
        }
      ]
    }
  ]
}
