{
  "id": "nanpore_fast5",
  "childProcessIds": [
    "process-epi2me-labs-wf-basecalling-1"
  ],
  "name": "Nanopore Sequencing (FAST5)",
  "desc": "Oxford Nanopore Technologies (ONT) sequencing data in FAST5 format",
  "executor": "INGEST",
  "documentationUrl": "https://<DOCS_SITE>/pipelines/catalog-nanopore-sequencing/#fast5-file-format",
  "code": {
    "repository": "NA",
    "uri": ""
  },
  "computeDefaults": [],
  "paramMapJson": "",
  "formJson": "",
  "webOptimizationJson": "",
  "fileMappingRules": [
    {
      "description": "Nanopore Sequencing (FAST5)",
      "min": 1,
      "fileNamePatterns": [
        {
          "exampleName": "SampleName.fast5",
          "description": "FAST5",
          "sampleMatchingPattern": "(?P<sampleName>[\\S ]*)\\.fast5"
        }
      ]
    }
  ]
}