{
  "id": "efd573d9-749b-473b-99a3-74ad82b84426",
  "childProcessIds": [
    "process-hutch-maddd-seq-1_0",
    "process-hutch-fastqc-1_0"
  ],
  "name": "MADDD-seq (FASTQ)",
  "desc": "FASTQ files generated from duplex genomes sequencing",
  "executor": "INGEST",
  "documentationUrl": "",
  "code": {
    "repository": "NA",
    "uri": ""
  },
  "computeDefaults": [],
  "paramMapJson": "",
  "formJson": "",
  "webOptimizationJson": "",
  "fileMappingRules": [
    {
      "description": "FASTQ Files",
      "min": 1,
      "fileNamePatterns": [
        {
          "exampleName": "SampleName_S1_L001_R1_001.fastq.gz",
          "description": "FASTQ (Illumina Format - with lane)",
          "sampleMatchingPattern": "(?P<sampleName>\\S*)_S(?P<libraryIndex>\\S*)_L(?P<lane>\\S*)_(?P<readType>R|I)(?P<read>1|2|3|4)_001\\.fastq\\.gz"
        },
        {
          "exampleName": "SampleName_L001_R1_001.fastq.gz",
          "description": "FASTQ (Illumina Format - no sample index)",
          "sampleMatchingPattern": "(?P<sampleName>[\\S]*)_L(?P<lane>\\S*)_(?P<readType>R|I)(?P<read>1|2|3|4)_001\\.fastq\\.gz"
        },
        {
          "exampleName": "SampleName_S1_R1_001.fastq.gz",
          "description": "FASTQ (Illumina Format - no lane)",
          "sampleMatchingPattern": "(?P<sampleName>\\S*)_S(?P<libraryIndex>\\S*)_(?P<readType>R|I)(?P<read>1|2|3|4)_001\\.fastq\\.gz"
        },
        {
          "exampleName": "SampleName_R1.fastq.gz",
          "description": "FASTQ",
          "sampleMatchingPattern": "(?P<sampleName>[\\S ]*)(\\.|_)(?P<readType>R|I|)(?P<read>1|2|3|4)\\.(fq|fastq)(\\.gz|)"
        },
        { 
          "exampleName": "SampleName.fastq.gz", 
          "description": "FASTQs", 
          "sampleMatchingPattern": "(?P<sampleName>[\\S ]*)\\.fastq\\.gz"
        }
      ]
    }
  ]
}
