{
  "id": "tcrseq",
  "childProcessIds": [],
  "name": "TCRseq / BCRseq (Paired FASTQ)",
  "desc": "FASTQ files generated from sequencing of TCR/BCR loci",
  "executor": "INGEST",
  "documentationUrl": "https://<DOCS_SITE>/pipelines/catalog-dna-sequencing/",
  "code": {
    "repository": "NA",
    "uri": ""
  },
  "computeDefaults": [],
  "paramMapJson": "",
  "formJson": "",
  "webOptimizationJson": "",
  "fileMappingRules": [
    {
      "description": "Paired FASTQs (R1/R2)",
      "min": 2,
      "fileNamePatterns": [
        {
          "exampleName": "SampleName_R1.fastq.gz",
          "description": "FASTQ",
          "sampleMatchingPattern": "(?P<sampleName>[\\S ]*)(\\.|_)(?P<readType>R|I|)(?P<read>1|2|3|4)\\.(fq|fastq)(\\.gz|)"
        },
        {
          "exampleName": "SampleName_S1_L001_R1_001.fastq.gz",
          "description": "FASTQ (Illumina Format - with lane)",
          "sampleMatchingPattern": "(?P<sampleName>\\S*)_S(?P<libraryIndex>\\S*)_L(?P<lane>\\S*)_(?P<readType>R|I)(?P<read>1|2|3|4)_001\\.fastq\\.gz"
        },
        {
          "exampleName": "SampleName_S1_R1_001.fastq.gz",
          "description": "FASTQ (Illumina Format - no lane)",
          "sampleMatchingPattern": "(?P<sampleName>\\S*)_S(?P<libraryIndex>\\S*)_(?P<readType>R|I)(?P<read>1|2|3|4)_001\\.fastq\\.gz"
        }
      ]
    }
  ]
}