{
  "id": "ingest_cram",
  "childProcessIds": [],
  "name": "CRAM",
  "desc": "Genomic sequences in CRAM format",
  "executor": "INGEST",
  "documentationUrl": "https://<DOCS_SITE>/pipelines/catalog-dna-sequencing/#uploading-bam-data",
  "code": {
    "repository": "NA",
    "uri": ""
  },
  "computeDefaults": [],
  "paramMapJson": "",
  "formJson": "",
  "webOptimizationJson": "",
  "fileMappingRules": [
    {
      "description": "CRAM Files",
      "min": 1,
      "fileNamePatterns": [
        {
          "exampleName": "SampleName.cram",
          "description": "CRAM",
          "sampleMatchingPattern": "(?P<sampleName>[\\S ]*).cram"
        }
      ]
    }
  ]
}