{
  "id": "spatial_region_json",
  "childProcessIds": [
    "process-hutch-quantitative-spatial-analysis-1_0"
  ],
  "name": "Spatial Region (JSON)",
  "desc": "Definition of a region relative to a spatial dataset",
  "executor": "INGEST",
  "documentationUrl": "https://<DOCS_SITE>/pipelines/catalog-spatial-analysis/#spatial-regions",
  "code": {
    "repository": "NA",
    "uri": ""
  },
  "computeDefaults": [],
  "paramMapJson": "",
  "formJson": "",
  "webOptimizationJson": "",
  "fileMappingRules": [
    {
      "description": "Spatial Region (JSON)",
      "min": 1,
      "isSample": false,
      "fileNamePatterns": [
        {
          "exampleName": "region.json",
          "description": "Spatial Region (JSON)",
          "sampleMatchingPattern": "region.json"
        }
      ]
    }
  ]
}