{
  "id": "process-nf-core-rnaseq-3_1",
  "childProcessIds": [
    "process-hutch-bulk-rna-lymphocyctes-1_0",
    "process-nf-core-differentialabundance-2_0"
  ],
  "dataType": "Gene Expression Summary (nf-core/rnaseq)",
  "name": "Quantify Gene Expression (nf-core/rnaseq)",
  "desc": "RNA sequencing analysis pipeline using STAR, RSEM, HISAT2 or Salmon with gene/isoform counts and extensive quality control",
  "executor": "NEXTFLOW",
  "pipelineTypeOverride": "nf-core",
  "category": "RNA Sequencing",
  "documentationUrl": "https://<DOCS_SITE>/pipelines/catalog-rna-sequencing/#rnaseq-nf-corernaseq",
  "code": {
    "repository": "GITHUBPUBLIC",
    "script": "main.nf",
    "uri": "nf-core/rnaseq",
    "version": "User Defined"
  },
  "allowMultipleSources": true,
  "usesSampleSheet": false,
  "computeDefaults": [
    {
      "executor": "NEXTFLOW",
      "json": "s3://<RESOURCES_BUCKET>/<PROCESS_DIRECTORY>/process-compute.config",
      "name": "Default"
    }
  ],
  "paramMapJson": "s3://<RESOURCES_BUCKET>/<PROCESS_DIRECTORY>/process-input.json",
  "preProcessScript": "s3://<RESOURCES_BUCKET>/<PROCESS_DIRECTORY>/preprocess.py",
  "formJson": "s3://<RESOURCES_BUCKET>/<PROCESS_DIRECTORY>/process-form.json",
  "webOptimizationJson": "s3://<RESOURCES_BUCKET>/<PROCESS_DIRECTORY>/process-output.json",
  "fileMappingRules": [
    {
      "description": "STAR Salmon Quantification",
      "min": 1,
      "fileNamePatterns": [
        {
          "exampleName": "star_salmon/sampleName/quant.sf",
          "description": "Quant.sf",
          "sampleMatchingPattern": "(?P<alignmentTool>[\\S ]*)/(?P<sampleName>[\\S ]*)/quant\\.sf"
        }
      ]
    },
    {
      "description": "STAR Salmon Aligned BAM",
      "min": 1,
      "fileNamePatterns": [
        {
          "exampleName": "star_salmon/sampleName.markdup.sorted.bam",
          "description": "sampleName.markdup.sorted.bam",
          "sampleMatchingPattern": "(?P<alignmentTool>[\\S ]*)/(?P<sampleName>[\\S ]*)\\.markdup\\.sorted\\.bam"
        }
      ]
    },
    {
      "description": "STAR Salmon Aligned BAM Index",
      "min": 1,
      "fileNamePatterns": [
        {
          "exampleName": "star_salmon/sampleName.markdup.sorted.bam.bai",
          "description": "sampleName.markdup.sorted.bam.bai",
          "sampleMatchingPattern": "(?P<alignmentTool>[\\S ]*)/(?P<sampleName>[\\S ]*)\\.markdup\\.sorted\\.bam\\.bai"
        }
      ]
    }
  ]
}