{
  "id": "process-cirro-genome-index-cellranger-arc-1-0",
  "parentProcessIds": [
    "genome_fasta"
  ],
  "childProcessIds": [],
  "dataType": "Genome Index (Cell Ranger ARC)",
  "name": "Build Genome Index (Cell Ranger ARC)",
  "desc": "Build a 10X Genomics Cell Ranger ARC multiome (ATAC + gene expression) reference with cellranger-arc mkref from genome, GTF, and optional ATAC TF motifs.",
  "executor": "NEXTFLOW",
  "category": "Reference Data",
  "documentationUrl": "https://<DOCS_SITE>/pipelines/catalog-reference/#genome-index-cellranger-arc",
  "code": {
    "repository": "GITHUBPUBLIC",
    "uri": "CirroBio/nf-index-genome",
    "version": "main",
    "script": "main_cellrangerarc.nf"
  },
  "allowMultipleSources": false,
  "usesSampleSheet": false,
  "computeDefaults": [
    {
      "executor": "NEXTFLOW",
      "json": "s3://<RESOURCES_BUCKET>/process/public/community/index_genomes/process-compute.config",
      "name": "Default"
    }
  ],
  "preProcessScript": "s3://<RESOURCES_BUCKET>/process/public/community/index_genomes/preprocess.py",
  "paramMapJson": "s3://<RESOURCES_BUCKET>/<PROCESS_DIRECTORY>/process-input.json",
  "formJson": "s3://<RESOURCES_BUCKET>/<PROCESS_DIRECTORY>/process-form.json",
  "webOptimizationJson": "s3://<RESOURCES_BUCKET>/<PROCESS_DIRECTORY>/process-output.json"
}
