{
  "id": "process-cirro-qupath-stardist-1_0",
  "parentProcessIds": [
    "images"
  ],
  "childProcessIds": [],
  "dataType": "Cell Detection Summary (StarDist)",
  "name": "Segment Cells (StarDist)",
  "desc": "Identify cells from microscopy image using the StarDist analysis module from QuPath",
  "executor": "NEXTFLOW",
  "category": "Image Analysis",
  "documentationUrl": "https://<DOCS_SITE>/pipelines/catalog-spatial-analysis/#cell-segmentation-stardist",
  "code": {
    "repository": "GITHUBPUBLIC",
    "uri": "CirroBio/nf-cell-segment",
    "version": "1.0.2",
    "script": "stardist.nf"
  },
  "computeDefaults": [
    {
      "executor": "NEXTFLOW",
      "json": "s3://<RESOURCES_BUCKET>/<PROCESS_DIRECTORY>/process-compute.config",
      "name": "Default"
    }
  ],
  "paramMapJson": "s3://<RESOURCES_BUCKET>/<PROCESS_DIRECTORY>/process-input.json",
  "formJson": "s3://<RESOURCES_BUCKET>/<PROCESS_DIRECTORY>/process-form.json",
  "webOptimizationJson": "s3://<RESOURCES_BUCKET>/<PROCESS_DIRECTORY>/process-output.json"
}