{
  "id": "ingest_aligned_bam",
  "childProcessIds": [
    "process-nf-core-sarek-call-variants-3-2"
  ],
  "name": "Aligned BAM",
  "desc": "Aligned genomic sequences in BAM format",
  "executor": "INGEST",
  "documentationUrl": "https://<DOCS_SITE>/pipelines/catalog-dna-sequencing/#uploading-bam-data",
  "code": {
    "repository": "NA",
    "uri": ""
  },
  "computeDefaults": [],
  "paramMapJson": "",
  "formJson": "",
  "webOptimizationJson": "",
  "fileMappingRules": [
    {
      "description": "Aligned BAMs",
      "min": 1,
      "fileNamePatterns": [
        {
          "exampleName": "SampleName.bam",
          "description": "BAM",
          "sampleMatchingPattern": "(?P<sampleName>[\\S ]*).bam"
        },
        {
          "exampleName": "SampleName.bam.bai",
          "description": "BAM Index",
          "sampleMatchingPattern": "(?P<sampleName>[\\S ]*).bam.bai"
        }
      ]
    }
  ]
}