{
  "id": "genome_cellranger-arc_index",
  "childProcessIds": [],
  "name": "Cell Ranger ARC Reference",
  "desc": "10x Genomics multiome (ATAC + gene expression) reference built with cellranger-arc mkref",
  "executor": "INGEST",
  "documentationUrl": "",
  "code": {
    "repository": "NA",
    "uri": ""
  },
  "computeDefaults": [],
  "paramMapJson": "",
  "formJson": "",
  "webOptimizationJson": "",
  "fileMappingRules": [
    {
      "description": "Reference metadata",
      "min": 1,
      "isSample": false,
      "fileNamePatterns": [
        {
          "exampleName": "cellrangerarc_reference/reference.json",
          "description": "Cell Ranger ARC reference metadata",
          "sampleMatchingPattern": "[\\S ]*reference.json"
        }
      ]
    },
    {
      "description": "ARC regions",
      "min": 1,
      "isSample": false,
      "fileNamePatterns": [
        {
          "exampleName": "cellrangerarc_reference/regions/tss.bed",
          "description": "Transcription start site regions BED",
          "sampleMatchingPattern": "[\\S ]*tss.bed"
        }
      ]
    }
  ]
}
